id,name,folder,category,description,keywords,trigger_phrases,zh_triggers,source_type,source_package,path
5a8d48169cc6,gsap-timeline,gsap-timeline,routing-process,"Use when sequencing GSAP animations, choreographing animation order, creating timelines, labels, nested timelines, timeline playback, position parameters, staggered sequences, or ordered motion.",about; absolute; add; addlabel; after; all; animates; animation; animation.; animations; another.; appended; apply; are; argument; before; best; both; building; call; callbacks.; can; chain; child; child.to; children.; choreographing; const; constructor; contain; controlling; controls; coordinating; create; creating; default; defaults; delay; determined; duration; e.g.; ease; ease.; eases; end; end.; ends; etc.; every; examples; forget; gsap; gsap-core; gsap-react; gsap-scrolltrigger; gsap-timeline; gsap.; gsap.timeline; inherit; inside; intro; its; javascript; keyframe-style; kill; label; label.; labelname; labelname+; labels; labels.; last; maintainable; many; master; master.add; master.to; merged; motion.; multi-step; nest; nested; nesting; new; not; official; oncomplete; one; only; onstart,,规划; 计划; 先想方案; 设计一下; 按计划执行; 拆任务; 并行处理; 新功能; 改行为,repo-skill,repository,skills\gsap-timeline\SKILL.md
eb97b9faade4,skill-router,skill-router,routing-process,"Use when choosing which local Codex skill should apply, when many installed skills may match, when routing a request by intent, or when the assistant should select the right process, coding, content, video, animation, document, agent, or security skill.",acting.; address; agency-agents; agent; agent-runtime-lab; agents; angles.; animation; animation.; animations; anime.js; animejs; api; apply; approval; approved; assistant; audits.; authoring; auto trigger; background; before; behavior; behavior.; blocks; both; brainstorming; breakers; broken; bugfixes; captions; categories; change; changes; changes.; checks.; choose; choose skill; choosing; choreography.; claiming; clamp; clean; cli; code; codex; coding; come; comments; common; complete; completed; components.; composition; compositions; concern; concrete; confirmation; consider; content; contribute; contribute-catalog; core; crashing; create; creative; css; css-animations; debugging; design; desired; deterministic; diagnostics; diagnostics.; dirty; discipline; discipline.; dispatching-parallel-agents; doctor; document; does; dom; domain; done; dotlottie; edit; effects.; environment.; execute; executing-plans,auto trigger; choose skill; natural language trigger; route skill; 技能路由; 自动触发,规划; 计划; 先想方案; 设计一下; 按计划执行; 拆任务; 并行处理; 新功能; 改行为,repo-skill,repository,skills\skill-router\SKILL.md
d7b828410b1e,subagent-driven-development,subagent-driven-development,routing-process,"Use when executing an implementation plan that has independent tasks in the current session, parallelizable steps, separable modules, or work that benefits from subagent task execution and review.",after; agents; all; also; ambiguity; answer; approves; are; asked; benefits; between; blocked; box; brainstorm; cannot; check; cluster_per_task; code; code-quality-reviewer-prompt.md; commits; complete; complete.; compliance; confirms; construct; context; context.; continue; continuous; coordination; core; coupled; crafting; create; current; delegate; development; diamond; digraph; dispatch; dispatching; dot; each; ensure; entire; exactly; execute; executing; executing-plans; execution; extract; fast; faster; fillcolor; filled; final; finishing-a-development-branch; first; fixes; focused; fresh; full; gaps; genuinely; has; have; high; history; human; human-in-loop; implementation; implementer; implementer-prompt.md; implements; independent; inherit; instructions; isolated; issues; it.; iteration; label; lightgreen; manual; mark; matches; modules; more; mostly; need.,,规划; 计划; 先想方案; 设计一下; 按计划执行; 拆任务; 并行处理; 新功能; 改行为,repo-skill,repository,skills\subagent-driven-development\SKILL.md
d8ea5a4e9fdf,superpowers-gated-planning,superpowers-gated-planning,routing-process,"Use when the user asks for planning before action, wait for confirmation, plan first, gated approvals, feature design, creative work, behavior changes, coding tasks with approval gates, or implementation planning.",action; actionable; active; advance; after; ambiguous; approach; approval; approval.; approvals; approve; approves; are; artifacts; ask; autonomy; available.; before; begin.; behavior; brainstorm; but; calls; changes; changes.; checklist; choose; chosen; code; coding; combine; commits.; committed; config; confirmation; constraints; continue; conversation; counts; creation; creative; dependency; design; designing; detailed; direction.; documents; doing; edits; efficiency.; execution; execution.; exists; explicit; explicitly; explore; feature; file; files; final; first; first.; formatting; gate; gate.; gated; gates; gates.; generated; get; harmless; implement; implement.; implementation; includes; installs; intent; it.; keep; like; making; may; must; never; next; not; only; option; options; overrides,,规划; 计划; 先想方案; 设计一下; 按计划执行; 拆任务; 并行处理; 新功能; 改行为,repo-skill,repository,skills\superpowers-gated-planning\SKILL.md
4e8857302815,using-git-worktrees,using-git-worktrees,routing-process,"Use when starting feature work that should be isolated, creating or using git worktrees, protecting a dirty workspace, executing implementation plans safely, or separating branch work from current changes.",accidentally; add; already; also; alternative; always; announce; another; any; anything; apply; appropriate; are; ask; asked; asking.; auto-detect; automatically.; available; available.; back; backward; based; baseline; basename; bash; beats; before; blocked; both; branch; branch_name; build; can; cargo; cargo.toml; change; changes.; check; check-ignore; checkout.; chosen; clean; cleanup; command; commit; committing; compatibility; concluding; config/superpowers/worktrees/; consent; contents; core; create; creates; creating; creation; critical; current; declared; declines; default; denial; detached; detect; determine; dev/null; directories; directory; dirty; does; download; ensure; enterworktree; error; executing; exist; existing; explicit; externally; fails; fall; fallback; feature; fight; filesystem; finish; first.; flag.; follow,,规划; 计划; 先想方案; 设计一下; 按计划执行; 拆任务; 并行处理; 新功能; 改行为,repo-skill,repository,skills\using-git-worktrees\SKILL.md
7ddd651e2c96,using-superpowers,using-superpowers,routing-process,"Use when starting a conversation or task, deciding whether any skill applies, enforcing skill checks before clarifying questions or actions, or preventing missed skill invocation.",about; absolutely; access; action; action.; actions; activate; activate_skill; activates; adapt; adaptation; agents.md; already; always; announce; any; anything.; applies; apply; approach; are; auto-discovered; automatically; away; become; before; behavior; box; brainstormed; brainstorming; bug; build; but; can; cannot; chance; check; check.; checklist; checks; choice.; clarifications; clarifying; claude; claude.md; cli; code; codebase; codex; comes; complex.; concept; conflict; content; context; context.; control.; conversation; copilot; could; count; create; current; debugging; deciding; default; definitely; demand.; determine; diamond; digraph; direct; directly.; discip; dispatched; documentation; doesn; doing; domain-specific; don; dot; doublecircle; enforcing; enterplanmode; environments; equivalents.; even; evolve.; exactly; exactly.,,规划; 计划; 先想方案; 设计一下; 按计划执行; 拆任务; 并行处理; 新功能; 改行为,repo-skill,repository,skills\using-superpowers\SKILL.md
fafa60cdfef0,writing-plans,writing-plans,routing-process,"Use when a spec, requirements, approved design, or multi-step task needs a written implementation plan before touching code or coordinating execution.",about; above; above.; action; actual; add; after; against; agentic; almost; always; announce; any; approach; appropriate; approved; architecture; are; assert; assume; assuming; bash; been; before; best; bite-sized; blocks; boundaries; brainstorming.; breaking; broken; builds; but; can; cases; change; changes; check; checkbox; checklist; clear; code; codebase; codebases; commands; commit; commits; commits.; complete; component; comprehensive; consistency; contain; content; context; coordinating; coverage; covers; create; created; decisions; decomposition; decomposition.; def; default; defined; defining; describe; describing; design; details; developer; dispatch.; docs; docs/superpowers/plans/yyyy-mm-dd-; document; domain.; don; dry; dry.; during; each; edge; edits; engineer; error; established; every; everything; exact,,规划; 计划; 先想方案; 设计一下; 按计划执行; 拆任务; 并行处理; 新功能; 改行为,repo-skill,repository,skills\writing-plans\SKILL.md
5a4da158278f,imagegen,imagegen,skill-authoring-local-diagnostics,"Use when generating or editing raster images, AI-created bitmap visuals, photos, illustrations, textures, sprites, mockups, transparent cutouts, image variants, or reference-based visual assets rather than SVG, vector, code-native, HTML, CSS, or canvas visuals.",after; ai-created; alpha.; already; antialiased; any; anything; appears; are; argument; art; ask; asked; asking; asset; assets; auto-key; background; batch; batch-generate; because; before; better; bitmap; both; brainstorming; built-in; bundled; call; can; canvas; chroma-key; clean; clearly; cli; cli.; cli/api/model; code-native; codex; codex_home/; codex_home/generated_images/...; codex_home/skills/.system/imagegen/scripts/remove_chroma_key.py; complex; compositing; composition; concept; confirms; confirms.; control.; controls; copy; cover; create; creating; css; current; cutouts; default; default.; describe; design; despill; destination; destination-path; destination.; diagrams; directly; docs/resources; does; doing; downgrade; edges.; edit; editable; editing; edits; else.; exactly; example; existing; exists; explain; explicitly; exposes; extending; fails; fallback; fallback-only; fallback.; file,,创建技能; 修改技能; 技能触发; 本地诊断; 扫描目录; 运行环境; 技能打包,repo-system,.system,skills\.system\imagegen\SKILL.md
1de6cf7def62,local-skill-enhanced,local-skill-enhanced,skill-authoring-local-diagnostics,"Use when the user asks to inspect local project files, list files, scan the workspace, show runtime info, run safe diagnostics, check current directory, whoami, shell routing, or basic local skill package behavior.",actions; answer; are; available; available.; basic; behavior.; bypass; change.; check; check.; codex; command; commands; current; deterministic; diagnostic; diagnostics; dir; direct; directory; dumping; enhanced; enhanced_skill.log; examples; executionpolicy; explicitly; file; files; final; helper; helpers; identify; imported; info; inspect; inspection; instead; keep; lightweight; list; listing; listings.; local; local-skill-enhanced; logging; logs; long; normal; not; only; package; package.; powershell; prefer; preserved; project; pwd; python; raw; read-only; relevant; rely; requested; requests.; result; routing; run; runtime; runtime-diagnostic; safe; scan; scripts/enhanced_local_skill.ps1; scripts/enhanced_local_skill.py; shell; shell/file; show; simple; summarize; supports; them; these; they; tools; troubleshooting; unless; usage; use; useful; userprofile,,创建技能; 修改技能; 技能触发; 本地诊断; 扫描目录; 运行环境; 技能打包,repo-skill,repository,skills\local-skill-enhanced\SKILL.md
5ad08896c47f,plugin-creator,plugin-creator,skill-authoring-local-diagnostics,"Use when creating, scaffolding, validating, or updating Codex plugins, personal plugin folders, .codex-plugin/plugin.json, plugin manifests, marketplace entries, plugin ordering, or plugin availability metadata.",absolute; accepts.; add; adding; agents/...; agents/plugins/marketplace.json; agents/plugins/marketplace.json.; agents/skills/plugin-creator/scripts/create_basic_plugin.py; agents/skills/plugin-creator/scripts/validate_plugin.py; all; allowed; always; another; app.json; appear; append; are; array; assets/; authentication; availability; available; back; bash; before; belongs; both; brand-new; category; chars.; code/plugins; codex; codex-plugin/plugin.json; codex.; collapsed; companion; consecutive; contain; containing; converted; create; created; creates; creating; creation; creator; default; defaults; destination; directory; displayname; does; each; edit; either; entries; entries.; entry; entry.; example; exist; existing; explicitly; file; fills; first; folder; folders; force; gating.; generate; generate/adjust; generated; gives; handing; hooks/; hyphen-case; hyphen-delimited; hyphens; include; individual; ingestion; inside; installation; installed_by_default; intentionally; interface; interface.displayname; it.; json,,创建技能; 修改技能; 技能触发; 本地诊断; 扫描目录; 运行环境; 技能打包,repo-system,.system,skills\.system\plugin-creator\SKILL.md
c0941e710406,skill-creator,skill-creator,skill-authoring-local-diagnostics,"Use when creating, updating, designing, packaging, testing, or improving Codex skills, SKILL.md files, skill folders, specialized workflows, knowledge extensions, tool integrations, or trigger descriptions.",about; acceptable; actual; add; affects; after; agent; agents; agents/; agents/openai.yaml; all; allows; already; anatomy; another; answer; apis; approach.; approaches; appropriate; are; artifacts; assets; assets/; assumption; avoid; before; behavior; behavior.; being; body; brand; bridge; bug; bundled; business; can; capabilities; challenge; chips; clear; cliffs; code; codex; color; company-specific; complex; comprehensive; concise; conclusions; configuration; consistency; consists; constraints; contains; context; context.; conversation; core; cost; create; create skill; creating; creator; critical; decisions; default; default_prompt; definitions; degrees; depend; describing; description; descriptions; descriptions.; designing; determine; deterministic; deterministically; diffs; display_name; documentation; does; doesn; domain; domains; during; each; effective; else,create skill; new skill; 创建skill; 创建技能; 技能打包; 更新skill,创建技能; 修改技能; 技能触发; 本地诊断; 扫描目录; 运行环境; 技能打包,repo-system,.system,skills\.system\skill-creator\SKILL.md
5ca5dacb477f,skill-installer,skill-installer,skill-authoring-local-diagnostics,"Use when listing, installing, importing, or updating Codex skills from curated sources, GitHub repositories, private repos, zip packages, local folders, or into $CODEX_HOME/skills.",aborts; about; accessed; accordingly; after; all; already; also; annotations; another; api.; approximately; are; ask; auth/permission; auto; available; back; based; basename; behavior; but; can; checkout.; codex; codex/skills; codex_home/skills; codex_home/skills.; codex_home/skills/; come; communication; context; credentials; curated; default; defaults; depending; dest; destination; direct; directory; do.; download; download.; each; error; errors; escalation; example; existing; exists.; exit.; experimental; explain; fails; fallback; falls; fetched; first; folders; follows; format; gh_token; git; github; github.com/; github.com/openai/skills/tree/main/skills/.curated; github.com/openai/skills/tree/main/skills/.experimental; github.com/openai/skills/tree/main/skills/.system; github_token; help; helper; helps; https; import skill; importing; including; insist; install; install skill; installed; installer; installing; installs; instead; json; just; label; like; list,import skill; install skill; zip安装; 安装skill; 安装技能; 私有库skill,创建技能; 修改技能; 技能触发; 本地诊断; 扫描目录; 运行环境; 技能打包,repo-system,.system,skills\.system\skill-installer\SKILL.md
