id,name,folder,category,description,keywords,trigger_phrases,zh_triggers,source_type,source_package,path
9269ad71a009,karpathy-guidelines,karpathy-guidelines,debugging-code-quality,"Use when writing, reviewing, debugging, or refactoring code where simplicity, minimal changes, clear assumptions, surgical edits, readability, verification, or Andrej Karpathy-style engineering discipline matters.",abstractions; add; adjacent; after; andrej; approach; aren; ask; ask.; asked.; assume.; assumptions; back; before; behavioral; beyond; bias; brief; broken.; bug; caution; changed; changes; check; clarification.; clean; clear; code; code.; coding; comments; common; configurability; confusing.; confusion.; constant; could; create; criteria; criteria.; dead; debugging; define; delete; derived; differently.; directly; discipline; don; editing; edits; engineer; engineering; ensure; error; even; every; execution; exist; existing; exists; explicitly.; features; first; fix; flexibility; formatting.; goal-driven; goals; guidelines; handling; hide; https; implementing; imports/variables/functions; impossible; improve; independently.; inputs; interpretations; invalid; it.; judgment.; karpathy; karpathy-guidelines; karpathy-style; let; line; lines; llm,,报错; 修复; 排查; 跑不起来; 失败; 崩溃; 卡住; 测试失败; 代码审查; 验收,repo-skill,repository,skills\karpathy-guidelines\SKILL.md
dd1394d909a9,receiving-code-review,receiving-code-review,debugging-code-quality,"Use when the user gives code review feedback, requested changes, reviewer comments, inline comments, unclear suggestions, questionable advice, or asks to address review feedback before implementation.",about; absolutely; acknowledging; acknowledgment; act; action; actions; actual; add; address; advice; afoot; after; against; agreement; all; any; anything; anyway; apology; architectural; are; ask; assuming; assuming.; avoiding; back; bad; batch; because; before; blind; blocking; both; breaks; brief; but; called.; can; carefully; catch; catching; changed; changes; check; checked; circle; clarification; clarify; clarifying; claude.md; code; codebase; comfort; comfort.; comments; common; complete; complex; conflicts; context; core; correct; correct.; correcting; correction; correctness; current; decisions; defending; defensiveness; delete; description; direction; discuss; does; don; each; easily; emotional; endpoint; evaluate; evaluation; example; examples; excellent; exist; existing; explicit; expression,,报错; 修复; 排查; 跑不起来; 失败; 崩溃; 卡住; 测试失败; 代码审查; 验收,repo-skill,repository,skills\receiving-code-review\SKILL.md
bd3d57d881ab,remotion-to-hyperframes,remotion-to-hyperframes,debugging-code-quality,"Use when the user explicitly asks to port, convert, migrate, translate, or rewrite an existing Remotion React video composition into a HyperFrames HTML composition.",a/b-testing; absolutefill; after; against; all; animated; antd; any; api; are; asking; async; audio; authoring; based; baseline; becomes; blocker; blockers; bottom; build.; but; calculatemetadata; calls; can; canonical; carrying; case; chakra; cleanly; code; comp; composition; composition-id; composition.; compositions; compositions.; config; construct; containing; contains; convert; corpus; css; custom; data-; data-composition-id; data-duration; data-fps; data-height; data-start; data-track-index; data-width; default; defaultprops; delayrender; deps; derivation; detects; direct; directory.; div; divs; don; doubt; drop; dropping; drops; easing; emit; encodes; equivalent; equivalents; eval; even; every; example; existing; explicitly; family; fires; fit; fixtures; flat; font-face; font.loadfont; fonts.md; freeze; fresh; gap,,报错; 修复; 排查; 跑不起来; 失败; 崩溃; 卡住; 测试失败; 代码审查; 验收,repo-skill,repository,skills\remotion-to-hyperframes\SKILL.md
ab17eea11540,requesting-code-review,requesting-code-review,debugging-code-quality,"Use when work is complete or near complete and the user wants review, asks to check implementation quality, verify requirements, find risks, review before merge, or inspect a major feature before shipping.",a7981ec; act; ad-hoc; add; added; after; apply; architecture; argue; assessment; awk; back; base_sha; baseline; bash; because; before; brief; bug; built; but; cascade.; catch; check; checkpoints; clarification; clean; code; code-reviewer.md; code/tests; commit; complete; completed; completing; complex; compound; context; continue; continued; core; crafted; critical; description; development; df7661; dispatch; docs/superpowers/plans/deployment-plan.md; each; early; ending; evaluation; example; executing; feature; feedback; fill; find; fix; fixing; flags; focused; fresh; function; general-purpose; get; gets; git; grep; head; head_sha; history.; how; ignore; immediately; implementation; important; indicators; inspect; integration; interval; issue; issues; just; keeps; later; let; log; magic; main; major,,报错; 修复; 排查; 跑不起来; 失败; 崩溃; 卡住; 测试失败; 代码审查; 验收,repo-skill,repository,skills\requesting-code-review\SKILL.md
e37fd224ba77,systematic-debugging,systematic-debugging,debugging-code-quality,"Use when something is broken, failing, crashing, hanging, flaky, slow, behaving unexpectedly, tests fail, commands error, setup does not work, or the user asks to debug, fix, diagnose, troubleshoot, inspect logs, 排查, 修复, 报错, 卡住, or find root cause.",actual; add; address; against; already; always; analysis; analyze; any; api; app; applying; are; ask; assume; assumptions; attempting; automated; available; backward; bad; bash; because; before; behaving; behavior; between; boundary; breaks; broken; bugs; bugs.; build; call; called; can; cannot; carefully; case; cause; cause.; causes; change; changed; changes; check; clearly; code; codebase; codes; codesign; commands; commits; compare; complete; completed; completely; component; components; config; consistently; contain; continuing; core; could; crashing; create; data; database; debug; debugging; debugging.; deep; dependencies; diagnose; diagnostic; did; didn; diff; difference; differences; different; directory; does; don; down; each; echo; emergencies; enters,error; exception; logs; root cause; stack trace; 修复; 报错; 排查; 跑不起来,报错; 修复; 排查; 跑不起来; 失败; 崩溃; 卡住; 测试失败; 代码审查; 验收,repo-skill,repository,skills\systematic-debugging\SKILL.md
46b66232500d,test-driven-development,test-driven-development,debugging-code-quality,"Use when implementing any feature, bugfix, behavior change, refactor, or code modification before writing implementation code, especially when tests, expected behavior, or verification can be defined first.",actually; ad-hoc.; adapt; add; after; all; already; always; any; api; are; ask; async; attempt; attempts; attempts++; automated; await; backoff; bad; bash; because; before; behavior; behavior.; beyond; box; bug; bugfix; but; can; cases; catch; ccccff; ccffcc; change; changes; clean; clear; code; comprehensive; configuration; confirm; const; core; correctly.; defined; delete; demonstrates; describes; desired; development; diamond; didn; digraph; domain; don; dot; duplication; easy; edge; ellipse; email; enough; error; errors; especially; everything; exceptions; existing; expect; expected; exponential; extract; fail; fail.; failed; failing; fails; failure; feature; feature.; features; ffcccc; files; fillcolor; filled; first; first.; fix,,报错; 修复; 排查; 跑不起来; 失败; 崩溃; 卡住; 测试失败; 代码审查; 验收,repo-skill,repository,skills\test-driven-development\SKILL.md
aa5fb5f87b62,verification-before-completion,verification-before-completion,debugging-code-quality,"Use when claiming work is complete, fixed, passing, ready, merged, or shippable, before committing or opening PRs, or when final verification, test evidence, command output, or proof of success is needed.",about; actual; agent; agents; all; always; always.; any; applies; apply; assumed; before; believe; bottom; broken; bug; build; cannot; changed; changes; check; checklist; claim; claiming; claims; clean; code; command; command.; commit/push/pr; committing; common; communication; compilation; compiler; complete; completed; completion; completion/correctness; confidence; confident; confirm; core; correct; count; crash; create; creation; cycle; delegating; delegation; diff; different; dishonesty; does; doesn; don; done; each; efficiency.; enough; errors; etc.; evidence; exact; exceptions; excuse; execute; exhaustion; exit; expressing; expression; extrapolation; fail; failure; failures; false; features; final; fix; fixed; flags; fresh; full; function; functions; gaps; gate; good; great,,报错; 修复; 排查; 跑不起来; 失败; 崩溃; 卡住; 测试失败; 代码审查; 验收,repo-skill,repository,skills\verification-before-completion\SKILL.md
860985300ac0,writing-skills,writing-skills,debugging-code-quality,"Use when creating, editing, packaging, testing, verifying, or improving Codex skills, SKILL.md files, descriptions, trigger behavior, skill folders, skill docs, or skill deployment.",SKILL.md; about; across; adapts; additional; addressing; again; agent; agent-specific; agents; agents/skills/; agentskills.io/specification; all; answer; anthropic; anthropic-best-practices.md.; api; applied; applies; apply; approach; approaches.; are; authoring; automate; background; baseline; before; before/after; behavior; benefit; best; broadly; bullet; bullets; calls; case; cases; characters; chars; claude; claude.md; claude/skills; close; code; codex; common; comparison; complement; compliance; complies; comply; comprehensive; concept; concepts; concrete; condition-based-waiting; conditions; constraints; contexts; conventions; core; create; creating; creation; critical; cso; cycle; cycle.; decide; decision; defines; deployment.; describes; description; descriptions; development; didn; directories; directory; discovery; docs; document; documentation; documentation.; does; don; editing; effective; else,SKILL.md; skill description; trigger behavior; 技能触发; 触发描述,报错; 修复; 排查; 跑不起来; 失败; 崩溃; 卡住; 测试失败; 代码审查; 验收,repo-skill,repository,skills\writing-skills\SKILL.md
a0f1a58f22ea,contribute-catalog,contribute-catalog,hyperframes-video,"Use when the user explicitly wants to contribute a HyperFrames registry block, caption style, VFX block, transition, lower third, text effect, overlay, snippet, catalog component, upstream PR, or public registry item.",abbreviation; absolute; acceptable; active; adapt; adjust; align-items; all; always; animates; animation; any; apply; ask; avoid; based; bash; block; block-name; blocks; bottom; build; building.; call; cap-hormozi; cap-typewriter; caption; card; cards; catalog; category; cdn; center; centered; ch-; char; character; characters; clarify; clobbers; collisions; color/scale; component; component-name; component.; components; composition; compositions/; compositions/components/; computed; console; contribut; contribute; contribute-catalog; convention; copy-paste; correct; create; css; cursors/decorative; data-composition-id; date.now; description; dimensions; display; docs/images/catalog/; duration; duration.; each; effect; effects; element; elements; errors; every; example; explicitly; files; fixed; flex; font; fonts.; full; function; g.end; generate; global; group; groupel; gsap,,做视频; 字幕; 配音; 视频合成; 网页转视频; 网址做成视频; 链接做视频; 宣传片; 产品视频; 产品宣传视频,repo-skill,repository,skills\contribute-catalog\SKILL.md
a5ec05e360d3,gsap,gsap,hyperframes-video,"Use when writing GSAP animations in HyperFrames, using gsap.to, from, fromTo, timelines, easing, stagger, labels, nesting, playback, transforms, quickTo, or deterministic GSAP motion for video compositions.",absolute; accent; accessibility; adapter.; after; aliases; alignment; all; also; alternates; always; amount; animate; animations; apply; argument; async; auto; auto-reverts; autoalpha; avoid; back; back.out; backgroundcolor; before; bounce; box; build; built-in; call; callbacks.; camelcase; ccw; cdn.jsdelivr.net/npm/gsap; center; circ; clearprops; code; combine; comma-separated; common; common.; complete.; composition; compositions.; compute; const; context; context.conditions; contract; controlling; controls; coordinate; core; create; creating; css; current; data-composition-id; default; defaults; deg; delay; deterministic; direction; directional; dist/gsap.min.js; don; duration; duration.; durations.; e.g.; each; ease; eases; easing; elastic; elastic.out; end; end.; ends; entrances; equal; equivalent; event; exact; explicit; expo; false; finite,,做视频; 字幕; 配音; 视频合成; 网页转视频; 网址做成视频; 链接做视频; 宣传片; 产品视频; 产品宣传视频,repo-skill,repository,skills\gsap\SKILL.md
b165c9b85cad,hyperframes,hyperframes,hyperframes-video,"Use when creating HyperFrames video compositions, HTML-based videos, animated scenes, captions, subtitles, voiceovers, audio-reactive visuals, title cards, overlays, transitions, marker sweeps, hand-drawn highlights, or full video production workflows.",accuracy; add; additional; adjust; against; agent; alternative; always; ambient; ambitious.; animate; animated; animation; any; appearance.; approach; approaches.; appropriate.; arc; are; ask; asked.; attributes; audience; audio; audio-reactive; available; b82f6; back; beats.; before; below.; best; both; brand; brand.; browse; browser; build; built-in; but; can; captions; captions.; card; cards; carry; casings; check; choice; clip; clips; closest; color; colors; colors/fonts; come; committed; composition; compositions; configures; consider; consistent; constraints.; consumers; content; conversation.; copies; correctly; create; creating; css; dark; data-; declare; define; defines; demo; design; design.md; developers; differ; different; direction; directory; discovery; discovery.; does; don; downstream,,做视频; 字幕; 配音; 视频合成; 网页转视频; 网址做成视频; 链接做视频; 宣传片; 产品视频; 产品宣传视频,repo-skill,repository,skills\hyperframes\SKILL.md
bb7ce6d28544,hyperframes-cli,hyperframes-cli,hyperframes-video,"Use when running or troubleshooting HyperFrames CLI commands such as init, lint, inspect, preview, render, doctor, browser, info, upgrade, build environment checks, or npx hyperframes dev loops.",actual; add; after; agent; agent-readable; alias; all; ancestor; animation; are; audio; audited; author; automatically.; available; back; bash; before; blank; box; browser; bubble; bubbles; bubbles/containers; build; but; byte-identical; canvas; canvas.; captions; cards; catches; changes.; checks; children; chrome; ci/agents; classes; cli; clip.mp4; clipped; clipping; codex-openai-video; coding; collapsed; commands; compact; compatibility; composition; compositions; compositions/; container; containers; context; copies; creates; creating; current; custom; data-composition-id; data-layout-allow-overflow; data-layout-ignore; decision-tree; decorative; default; delivery; denser; dev; directory; docker; doctor; draft; editing; element; entrance/exit; environment; errors; escaping; especially; everything; example; explicit; extending; fail; fast; ffmpeg.; file; files; final; final.mp4,,做视频; 字幕; 配音; 视频合成; 网页转视频; 网址做成视频; 链接做视频; 宣传片; 产品视频; 产品宣传视频,repo-skill,repository,skills\hyperframes-cli\SKILL.md
48b637fe9afb,hyperframes-media,hyperframes-media,hyperframes-video,"Use when preparing HyperFrames media assets, generating TTS voiceover, choosing voices, transcribing audio or video, creating captions from speech, removing image or video backgrounds, or chaining TTS, transcription, and captions.",accents; accessibility; added; af_heart; af_nova; af_sky; after; all; am_adam; am_michael; american; api; approachable; appropriate; apt-get; array; assets; audio; audio.mp3; audio/video; authoritative; auto-detection; auto-detects; avatar; background; backgrounds; backwards; base; bash; benefit; bf_emma; bm_george; brazilian; brew; british; cache/hyperframes/; cache/hyperframes/tts/; cached; caches; caption; caption-quality; captions; captions.; carefully; casual; chaining; checks; choosing; cleaning; clear; cli; clips; code; codes; commands; compatibility.; complex; composition; compositions; consume; content; content.; conventions.; creating; default; demo; destroys; documentation; downloads; drop; during; each; easy; ef_dora; element; empieza; en-gb; en-us; encode; end; energetic; english; english.; es.wav; espeak-ng; every; existing; explicitly; fast; fastest,,做视频; 字幕; 配音; 视频合成; 网页转视频; 网址做成视频; 链接做视频; 宣传片; 产品视频; 产品宣传视频,repo-skill,repository,skills\hyperframes-media\SKILL.md
f6ce99c2a564,hyperframes-registry,hyperframes-registry,hyperframes-video,"Use when installing, adding, wiring, or discovering HyperFrames registry blocks or components, using hyperframes add, editing hyperframes.json, merging component snippets, or connecting registry items to index.html.",add; adding; after; any; appears; are; assets; attributes; available; bash; before; block; blocks; blocks.; browse; calls; canvas; ci/headless; cli; clipboard; code; comment; component; components; components.; composition; composition.; compositions; compositions/; compositions/components; compositions/components/; compositions/components/grain-overlay.html; compositions/data-chart.html; configurable; connecting; contains; content; copy; css; curl; data-chart; data-composition-id; data-composition-src; data-duration; data-height; data-start; data-track-index; data-width; default.; description; details; details.; dimensions; dir; directly; discover; discovering; discovery; discovery.md; div; duration; e.g.; each; editing; effect; elements; example; examples; existing; exposes; file; files; filtering; front; full; grain-overlay; gsap; higher; host; how; html; html.; https; hyperframes; hyperframes-registry; hyperframes.json; include; included; index.html; index.html.,,做视频; 字幕; 配音; 视频合成; 网页转视频; 网址做成视频; 链接做视频; 宣传片; 产品视频; 产品宣传视频,repo-skill,repository,skills\hyperframes-registry\SKILL.md
64b4a7119178,lottie,lottie,hyperframes-video,"Use when embedding Lottie or dotLottie animations in HyperFrames, using lottie-web, .lottie files, @lottiefiles/dotlottie-web, After Effects exports, window.__hfLottie, or deterministic Lottie rendering.",accents; adapter; adapter.; after; airbnb; all; already; anim; animation; animations; apis; are; asset; assets; assets/; assets/logo-reveal.json; assets/product-flow.lottie; assuming; asynchronously; autoplay; avoid; backgroundanim; bash; because; block; both; browser; can; canvas; cdnjs.cloudflare.com/ajax/libs/bodymovin/5.12.2/lottie.min.js; class; composition; confettianim; const; container; contract; correctly; credits; css; css.; decorative; depending; deterministic; developers.lottiefiles.com/docs/dotlottie-player/dotlottie-web/methods; dimensions; display; div; document.getelementbyid; dotlottie; each; editing; effects; embedding; encoded; every; explicitly; export.; exports; false; file; files; first.; fit; frame; github.com/airbnb/lottie-web; github.com/airbnb/lottie-web/wiki/loadanimation-options; good; gotoandstop; has; height; html; html.; https; hyperframes; icon; iconanim; inspected; its; json; keep; known; lint; load; loadanimation; loading; local; logo; logo-lottie; loop; loop.,,做视频; 字幕; 配音; 视频合成; 网页转视频; 网址做成视频; 链接做视频; 宣传片; 产品视频; 产品宣传视频,repo-skill,repository,skills\lottie\SKILL.md
abaa455d40b3,website-to-hyperframes,website-to-hyperframes,hyperframes-video,"Use when the user provides a website URL or link and wants a HyperFrames video, promo, product tour, social ad, launch video, capture, website-to-video conversion, or says turn this site into video content.",about; accents; active; against; agent; align; already; any; approve.; approved; arc; architecture; are; artifact; ask; asset; assets; assets.; audience.; audio; autonomous; back.; background; beat; beat-by-beat; beats; beats.; been; before; billboard-per-beat; blocks; both; brand; build; building; can; captions; captions.; capture; captured; ceil; cheat; checklist; choices; chosen; collaborative; color; colors; communicate; complex; component; compositions; compositions.; compositions/beat-n.html; computed; concept-first; constraints; content; content.; contents; conversion; count; covering; create; critically; data; decide; deep-dive; default; deliver; delivering.; depth; design-styles.json; design.md; directly; document.; does; driver; duration; duration_seconds; durations.; each; either; elevenlabs; end.; errors; every; exact; exist; exists,turn site into video; website to video; 产品宣传视频; 网址做成视频; 网站做视频; 网页转视频; 链接做视频,做视频; 字幕; 配音; 视频合成; 网页转视频; 网址做成视频; 链接做视频; 宣传片; 产品视频; 产品宣传视频,repo-skill,repository,skills\website-to-hyperframes\SKILL.md
63c0449d8634,openai-docs,openai-docs,openai-api-apps,"Use when the user asks how to build with OpenAI products or APIs and needs up-to-date official documentation with citations, help choosing the latest model for a use case, or model upgrade and prompt-upgrade guidance; prioritize OpenAI docs MCP tools, use bundled references only as helper context, and restrict any fallback browsing to official OpenAI domains.",API key; ChatGPT应用; OpenAI接口; accurately.; active; add; after; agent; agentic; agents; alias; also; always; ambiguous; any; apache; api; api-backed; api/provider; apis; app; approval.; apps; are; artifact.; ask; attempt; authoritative; available; available.; back; baselines; both; broader; browse; browsing; build; building; bundled; can; case; changes; chat; chatgpt; chatgpt.; choosing; citations; clarify; clear; cli; code.; codex; codex.; coding; command; command.; comparisons; completions; component; comprising; conceptual; configure; content.; context; conversation.; conversations.; credential; current; debug; default-model; defaults; derived; designed; developer; developer-docs; developers.openai.com; developers.openai.com/api/docs/guides/latest-model.md; developers.openai.com/mcp; development; direct; directly; directly.; disclose; discover; doc; docs; docs-only; documentation; domains.; due,,OpenAI接口; API key; 智能体; 模型; ChatGPT应用; 评测,repo-system,.system,skills\.system\openai-docs\SKILL.md
d1f8e30c241e,brainstorming,brainstorming,routing-process,"Use when starting creative work, feature design, behavior changes, app components, product ideas, UI flows, content direction, or any request that needs intent, requirements, design, tradeoffs, or approval before implementation.",action; after; ahead; all; ambiguity; analytics; anti-pattern; any; app; applies; approaches; appropriately-scoped; approval; approval.; approved; approves; are; ask; asking; assess; assumptions; before; behavior; believe; below; below.; billing; box; brainstorm; brainstorming; break; build; building; built; but; can; cause; change; changes; chat; check; checklist; choice; clarifying; code; collaborative; combined; commit; commits; companion; complete; complexity; components; config; constraints; content; context; contradictions; conversationally; create; creative; criteria; current; cycle.; decompose; decomposed; describes; design; design.md; designs; detailed; details; dialogue.; diamond; different; digraph; direction; doc; docs; docs/superpowers/specs/yyyy-mm-dd-; don; dot; doublecircle; e.g.; each; every; explain; exploration; explore; exploring,,规划; 计划; 先想方案; 设计一下; 按计划执行; 拆任务; 并行处理; 新功能; 改行为,repo-skill,repository,skills\brainstorming\SKILL.md
2aa0e855dc75,executing-plans,executing-plans,routing-process,"Use when the user provides or approves a written implementation plan, asks to execute a plan, continue from a plan, run planned tasks, or work through checkpoints in a separate execution session.",about; access; after; all; announce; any; approach; approves; are; ask; ask.; available; based; before; better; bite-sized; blocked; blocker; blockers; branch; checkpoints; choice; clarification; claude; code; codex; complete; complete.; completed; concerns; consent; continue; create; creates; critical; critically; dependency; development; don; each; earlier; ensures; exactly; execute; executes; executing; executing-plans; execution; existing; explicit; fails; feedback; file; finishing-a-development-branch; first; follow; force; fundamental; gaps; guess; guessing.; has; help; higher; hit; human; identify; immediately; implement; implementation; in_progress; instead; instruction; integration; isolated; its; load; main/master; mark; missing; much; needs; never; note; one; options; overview; partner; plan; plan.,,规划; 计划; 先想方案; 设计一下; 按计划执行; 拆任务; 并行处理; 新功能; 改行为,repo-skill,repository,skills\executing-plans\SKILL.md
